{"schema_version":"0.1.0","protocol_version":"0.1.0","learner_id":"learner-local-001","updated_at":"2026-08-26T04:02:00Z","goal":{"overall_target":8.0,"section_minimums":{"listening":7.5,"reading":7.5,"writing":7.5,"speaking":7.5}},"official_results":[],"practice_results":[],"ai_estimates":[],"coach_inferences":[],"skill_evidence":[{"skill_id":"reading.tfng.semantic-relation","state":"emerging","evidence_refs":["evt-007","evt-010"]}]}
